pks_straftat_bezeichnung;justiz_straftat_bezeichnung_mapped
(Vorsätzliche) Brandstiftung und Herbeiführen einer Brandgefahr §§ 306-306c, 306f Abs. 1 und 2 StGB;Gemeingefährliche einschl. Umweltstraftaten (o.V.)
2;NICHT GEFUNDEN - BITTE MANUELL EINTRAGEN
Abbruch der Schwangerschaft §§ 218, 218b, 218c, 219a, 219b StGB;NICHT GEFUNDEN - BITTE MANUELL EINTRAGEN
Abbruch der Schwangerschaft §§ 218, 218b, 218c, 219b StGB;NICHT GEFUNDEN - BITTE MANUELL EINTRAGEN
Abbruch der Schwangerschaft §§ 218, 218b, 219a, StGB;NICHT GEFUNDEN - BITTE MANUELL EINTRAGEN
Abfallein- / -aus- und -durchfuhr § 326 Abs. 2 StGB;Gemeingefährliche einschl. Umweltstraftaten (o.V.)
Abgabe, Verabreichung oder Überlassung von Betäubungsmitteln an Minderjährige § 29a Abs. 1 Nr. 1, ggf. § 30 Abs. 1 Nr. 2 BtMG;Straftaten nach dem Betäubungsmittelgesetz
Abrechnungsbetrug;Betrug
Alle sonstigen Straftaten gemäß StGB - ohne Verkehrsdelikte -;Straftaten im Straßenverkehr nach dem StGB
Alle sonstigen besonders schweren Fälle der Bestechlichkeit § 335 StGB;NICHT GEFUNDEN - BITTE MANUELL EINTRAGEN
Alle sonstigen besonders schweren Fälle der Bestechung nach § 335 StGB;NICHT GEFUNDEN - BITTE MANUELL EINTRAGEN
Alle übrigen (vorsätzlichen) Tötungen §§ 212, 213, 216, 217 StGB;Mord und Totschlag
Allgemeine Verstöße § 29 BtMG (soweit nicht unter 7340 pp. zu erfassen);Straftaten nach dem Betäubungsmittelgesetz
Allgemeiner Verstoß mit Amphetamin und seinen Derivaten in Pulver- oder flüssiger sowie in Tabletten- bzw. Kapselform (Ecstasy);Straftaten nach dem Betäubungsmittelgesetz
Allgemeiner Verstoß mit Cannabis und Zubereitungen;Straftaten nach dem Betäubungsmittelgesetz
Allgemeiner Verstoß mit Heroin;Straftaten nach dem Betäubungsmittelgesetz
Allgemeiner Verstoß mit Kokain einschl. Crack;Straftaten nach dem Betäubungsmittelgesetz
Allgemeiner Verstoß mit LSD;Straftaten nach dem Betäubungsmittelgesetz
Allgemeiner Verstoß mit Methamphetamin in Pulver-, kristalliner oder flüssiger sowie in Tabletten- bzw. Kapselform;Straftaten nach dem Betäubungsmittelgesetz
Allgemeiner Verstoß mit NPS (BtMG);Straftaten nach dem Betäubungsmittelgesetz
Allgemeiner Verstoß mit sonstigen Betäubungsmitteln;Straftaten nach dem Betäubungsmittelgesetz
Angriff auf den Luft- und Seeverkehr § 316c StGB;Straftaten im Straßenverkehr nach dem StGB
Anlagebetrug § 263 StGB;Betrug
Arbeitsvermittlungsbetrug;Betrug
Ausbeuten von Prostituierten § 180a StGB;Vergewaltigung
Ausnutzen sexueller Neigung §§ 180, 180a, 181a, 184, 184a, 184b, 184c, 184d, 184e, 184f, 184g, 184k StGB;Vergewaltigung
Ausnutzen sexueller Neigung §§ 180, 180a, 181a, 184, 184a, 184b, 184c, 184e, 184f, 184g, 184k, 184l StGB;Vergewaltigung
Ausspähen, Abfangen von Daten einschl. Vorbereitungshandlungen und Datenhehlerei §§ 202a, 202b, 202c, 202d StGB;Diebstahl und Unterschlagung
Bandenhehlerei von Kfz § 260 Abs. 1 Nr. 2 StGB;Diebstahl und Unterschlagung
Bankrott § 283 StGB;NICHT GEFUNDEN - BITTE MANUELL EINTRAGEN
Bedrohung § 241 StGB;NICHT GEFUNDEN - BITTE MANUELL EINTRAGEN
Begünstigung, Strafvereitelung (ohne Strafvereitelung im Amt), Hehlerei und Geldwäsche §§ 257, 258, 259-261 StGB;Diebstahl und Unterschlagung
Beleidigung auf sexueller Grundlage §§ 185-187, 189 StGB;Vergewaltigung
Beleidigung §§ 185-187, 189 StGB;NICHT GEFUNDEN - BITTE MANUELL EINTRAGEN
Beraubung von Taxifahrern;Raub u. Erpressung,räuber. Angriff auf Kraftfahrer
Bereitstellung von Geldmitteln oder anderen Vermögensgegenständen § 29 Abs. 1 Nr. 13 BtMG;Straftaten nach dem Betäubungsmittelgesetz
Beschädigung, Zerstörung oder Veränderung von Kulturgut § 83 Abs. 3 KGSG;NICHT GEFUNDEN - BITTE MANUELL EINTRAGEN
Besonders schwerer Fall des Bankrotts § 283a StGB;NICHT GEFUNDEN - BITTE MANUELL EINTRAGEN
Bestechlichkeit - gewerbsmäßig oder als Mitglied einer Bande § 335 Abs. 2 Nr. 3 StGB;NICHT GEFUNDEN - BITTE MANUELL EINTRAGEN
Bestechlichkeit im Gesundheitswesen;NICHT GEFUNDEN - BITTE MANUELL EINTRAGEN
Bestechlichkeit und Bestechung im geschäftlichen Verkehr und im Gesundheitswesen §§ 299, 299a, 299b und 300 StGB;Straftaten im Straßenverkehr nach dem StGB
Bestechlichkeit und Bestechung § 299 StGB;NICHT GEFUNDEN - BITTE MANUELL EINTRAGEN
Bestechlichkeit und Bestechung, Vorteil großen Ausmaßes § 300 Satz 2 Nr. 1 StGB;NICHT GEFUNDEN - BITTE MANUELL EINTRAGEN
Bestechlichkeit und Bestechung, gewerbsmäßig oder als Mitglied einer Bande § 300 Satz 2 Nr. 2 StGB;NICHT GEFUNDEN - BITTE MANUELL EINTRAGEN
Bestechlichkeit § 332 StGB;NICHT GEFUNDEN - BITTE MANUELL EINTRAGEN
Bestechung - gewerbsmäßig oder als Mitglied einer Bande nach § 335 Abs. 2 Nr. 3 StGB;NICHT GEFUNDEN - BITTE MANUELL EINTRAGEN
Bestechung im Gesundheitswesen;NICHT GEFUNDEN - BITTE MANUELL EINTRAGEN
Bestechung § 334 StGB;NICHT GEFUNDEN - BITTE MANUELL EINTRAGEN
Betrug bzw. Computerbetrug mittels rechtswidrig erlangter Daten von Zahlungskarten §§ 263, 263a StGB;Betrug
Betrug bzw. Computerbetrug mittels rechtswidrig erlangter sonstiger unbarer Zahlungsmittel  §§ 263, 263a StGB;Betrug
Betrug bzw. Computerbetrug mittels rechtswidrig erlangter sonstiger unbarer Zahlungsmittel §§ 263, 263a StGB;Betrug
Betrug bzw. Computerbetrug mittels rechtswidrig erlangter unbarer Zahlungsmittel;Betrug
Betrug mittels rechtswidrig erlangter Zahlungskarten ohne PIN (Lastschriftverfahren);Betrug
Betrug und Untreue im Zusammenhang mit Beteiligungen und Kapitalanlagen (Wikri);Betrug
Betrug z.N.v. Versicherungen und Versicherungsmissbrauch §§ 263, 265 StGB;Betrug
Betrug §§ 263, 263a, 264, 264a, 265, 265a-e StGB;Betrug
Betrügerisches Erlangen von Kfz §§ 263, 263a StGB;NICHT GEFUNDEN - BITTE MANUELL EINTRAGEN
Betäubungsmittelanbau, -herstellung und -handel §§ 30 Abs. 1 Nr. 1, 30a BtMG;Straftaten nach dem Betäubungsmittelgesetz
Brandstiftung und Herbeiführen einer Brandgefahr §§ 306-306d, 306f StGB;Gemeingefährliche einschl. Umweltstraftaten (o.V.)
Computerbetrug (sonstiger) § 263a StGB (soweit nicht unter den Schlüsseln 511120, 511212, 516300, 516520, 516920, 517220, 517900, 518112 bzw. 518302 zu erfassen);Betrug
Computerbetrug mittels rechtswidrig erlangter Zahlungskarten mit PIN § 263a StGB;Betrug
Computerbetrug § 263a StGB;Betrug
Computerkriminalität;NICHT GEFUNDEN - BITTE MANUELL EINTRAGEN
Cybercrime;NICHT GEFUNDEN - BITTE MANUELL EINTRAGEN
Datenveränderung, Computersabotage §§ 303a, 303b StGB;NICHT GEFUNDEN - BITTE MANUELL EINTRAGEN
Delikte im Zusammenhang mit Schwarzarbeitsbekämpfungsgesetz und Arbeitnehmerüberlassungsgesetz;NICHT GEFUNDEN - BITTE MANUELL EINTRAGEN
Diebstahl insgesamt;Diebstahl und Unterschlagung
Diebstahl insgesamt an/aus Kraftfahrzeugen;Diebstahl und Unterschlagung
Diebstahl insgesamt in/aus Banken, Sparkassen, Postfilialen und -agenturen und dergleichen;Diebstahl und Unterschlagung
Diebstahl insgesamt in/aus Boden-, Kellerräumen und Waschküchen;Diebstahl und Unterschlagung
Diebstahl insgesamt in/aus Dienst-, Büro-, Fabrikations-, Werkstatt- und Lagerräumen;Diebstahl und Unterschlagung
Diebstahl insgesamt in/aus Gaststätten, Kantinen, Hotels und Pensionen;Diebstahl und Unterschlagung
Diebstahl insgesamt in/aus Kiosken, Warenhäusern, Verkaufsräumen, Selbstbedienungsläden, Schaufenstern und Schaukästen darunter:;Diebstahl und Unterschlagung
Diebstahl insgesamt in/aus Kiosken, Warenhäusern, Verkaufsräumen, Selbstbedienungsläden, Schaufenstern, Schaukästen und Vitrinen darunter:;Diebstahl und Unterschlagung
Diebstahl insgesamt in/aus Wohnungen;Diebstahl und Unterschlagung
Diebstahl insgesamt in/aus überwiegend unbezogenen Neu- und Rohbauten und Baustellen;Diebstahl und Unterschlagung
Diebstahl insgesamt in/aus überwiegend unbezogenen Neu- und Rohbauten, Baubuden und Baustellen;Diebstahl und Unterschlagung
Diebstahl insgesamt und zwar:;Diebstahl und Unterschlagung
Diebstahl insgesamt von Antiquitäten, Kunst- und sakralen Gegenständen;Diebstahl und Unterschlagung
Diebstahl insgesamt von Betäubungsmitteln aus Apotheken;Diebstahl und Unterschlagung
Diebstahl insgesamt von Betäubungsmitteln aus Arztpraxen;Diebstahl und Unterschlagung
Diebstahl insgesamt von Betäubungsmitteln aus Krankenhäusern;Diebstahl und Unterschlagung
Diebstahl insgesamt von Betäubungsmitteln bei Herstellern und Großhändlern;Diebstahl und Unterschlagung
Diebstahl insgesamt von Fahrrädern einschl. unbefugte Ingebrauchnahme;Diebstahl und Unterschlagung
Diebstahl insgesamt von Kraftwagen einschl. unbefugte Ingebrauchnahme;Diebstahl und Unterschlagung
Diebstahl insgesamt von Mopeds und Krafträdern einschl. unbefugte Ingebrauchnahme;Diebstahl und Unterschlagung
Diebstahl insgesamt von Rezeptformularen zur Erlangung von Betäubungsmitteln;Diebstahl und Unterschlagung
Diebstahl insgesamt von Schusswaffen;Diebstahl und Unterschlagung
Diebstahl insgesamt von unbaren Zahlungsmitteln;Diebstahl und Unterschlagung
Diebstahl insgesamt von/aus Automaten;Diebstahl und Unterschlagung
Diebstahl ohne erschwerende Umstände §§ 242, 247, 248a-c StGB;Diebstahl und Unterschlagung
Diebstahl ohne erschwerende Umstände §§ 242, 247, 248a-c StGB und zwar:;Diebstahl und Unterschlagung
Diebstahl unter erschwerenden Umständen § 243, 244 StGB;Diebstahl und Unterschlagung
Diebstahl unter erschwerenden Umständen §§ 243-244a StGB;Diebstahl und Unterschlagung
Diebstahl unter erschwerenden Umständen §§ 243-244a StGB und zwar:;Diebstahl und Unterschlagung
Einfacher Diebstahl an/aus Kraftfahrzeugen;Diebstahl und Unterschlagung
Einfacher Diebstahl in/aus Banken, Sparkassen, Postfilialen und -agenturen und dergleichen;Diebstahl und Unterschlagung
Einfacher Diebstahl in/aus Boden-, Kellerräumen und Waschküchen;Diebstahl und Unterschlagung
Einfacher Diebstahl in/aus Dienst-, Büro-, Fabrikations-, Werkstatt- und Lagerräumen;Diebstahl und Unterschlagung
Einfacher Diebstahl in/aus Gaststätten, Kantinen, Hotels und Pensionen;Diebstahl und Unterschlagung
Einfacher Diebstahl in/aus Kiosken, Warenhäusern, Verkaufsräumen, Selbstbedienungsläden, Schaufenstern und Schaukästen darunter:;Diebstahl und Unterschlagung
Einfacher Diebstahl in/aus Kiosken, Warenhäusern, Verkaufsräumen, Selbstbedienungsläden, Schaufenstern, Schaukästen und Vitrinen darunter:;Diebstahl und Unterschlagung
Einfacher Diebstahl in/aus Wohnungen;Diebstahl und Unterschlagung
Einfacher Diebstahl in/aus überwiegend unbezogenen Neu- und Rohbauten und Baustellen;Diebstahl und Unterschlagung
Einfacher Diebstahl in/aus überwiegend unbezogenen Neu- und Rohbauten, Baubuden und Baustellen;Diebstahl und Unterschlagung
Einfacher Diebstahl von Antiquitäten, Kunst- und sakralen Gegenständen;Diebstahl und Unterschlagung
Einfacher Diebstahl von Betäubungsmitteln aus Apotheken;Diebstahl und Unterschlagung
Einfacher Diebstahl von Betäubungsmitteln aus Arztpraxen;Diebstahl und Unterschlagung
Einfacher Diebstahl von Betäubungsmitteln aus Krankenhäusern;Diebstahl und Unterschlagung
Einfacher Diebstahl von Betäubungsmitteln bei Herstellern und Großhändlern;Diebstahl und Unterschlagung
Einfacher Diebstahl von Fahrrädern einschl. unbefugte Ingebrauchnahme;Diebstahl und Unterschlagung
Einfacher Diebstahl von Kraftwagen einschl. unbefugte Ingebrauchnahme;Diebstahl und Unterschlagung
Einfacher Diebstahl von Mopeds und Krafträdern einschl. unbefugte Ingebrauchnahme;Diebstahl und Unterschlagung
Einfacher Diebstahl von Rezeptformularen zur Erlangung von Betäubungsmitteln;Diebstahl und Unterschlagung
Einfacher Diebstahl von Schusswaffen;Diebstahl und Unterschlagung
Einfacher Diebstahl von unbaren Zahlungsmitteln;Diebstahl und Unterschlagung
Einfacher Diebstahl von/aus Automaten;Diebstahl und Unterschlagung
Einfacher Ladendiebstahl;Diebstahl und Unterschlagung
Einmietbetrug;Betrug
Einschleusen mit Todesfolge, gewerbs- und bandenmäßiges Einschleusen von Ausländern § 97 Aufenthaltsgesetz;Straftaten nach dem Aufenthaltsgesetz
Einschleusen von Ausländern § 96 Aufenthaltsgesetz;Straftaten nach dem Aufenthaltsgesetz
Einwirken auf Kinder § 176 Abs. 4 Nr. 3 und 4 StGB;NICHT GEFUNDEN - BITTE MANUELL EINTRAGEN
Entziehung Minderjähriger § 235 StGB;NICHT GEFUNDEN - BITTE MANUELL EINTRAGEN
Erpresserischer Menschenraub i.V.m. Raubüberfall auf Geld- und Werttransporte;Raub u. Erpressung,räuber. Angriff auf Kraftfahrer
Erpresserischer Menschenraub i.V.m. Raubüberfall auf Geldinstitute, Postfilialen und -agenturen;Raub u. Erpressung,räuber. Angriff auf Kraftfahrer
Erpresserischer Menschenraub i.V.m. Raubüberfall auf sonstige Kassenräume und Geschäfte;Raub u. Erpressung,räuber. Angriff auf Kraftfahrer
Erpresserischer Menschenraub § 239a StGB;Raub u. Erpressung,räuber. Angriff auf Kraftfahrer
Erpressung auf sexueller Grundlage;Raub u. Erpressung,räuber. Angriff auf Kraftfahrer
Erpressung § 253 StGB;Raub u. Erpressung,räuber. Angriff auf Kraftfahrer
Erschleichen eines Aufenthaltstitels (§ 95 Abs. 2 Nr. 2 Aufenthaltsgesetz) durch unrichtige oder unvollständige Angaben oder Gebrauch eines so beschafften Aufenthaltstitels zur Täuschung im Rechtsverkehr;Betrug
Erschleichen von Leistungen § 265a StGB;Betrug
Euroschecks;NICHT GEFUNDEN - BITTE MANUELL EINTRAGEN
Exhibitionistische Handlungen und Erregung öffentlichen Ärgernisses §§ 183, 183a StGB;Vergewaltigung
Exhibitionistische/sexuelle Handlungen vor Kindern § 176 Abs. 4 Nr. 1 StGB;Vergewaltigung
Exhibitionistische/sexuelle Handlungen vor Kindern § 176a Abs. 1 Nr. 1 StGB;Vergewaltigung
Fahrlässige Körperverletzung § 229 StGB;Körperverletzung
Fahrlässige Tötung § 222 StGB;Mord und Totschlag
Fahrlässige Tötung § 222 StGB - nicht i.V.m. Verkehrsunfall -;Mord und Totschlag
Fehlerhafte Herstellung einer kerntechnischen Anlage § 312 StGB;NICHT GEFUNDEN - BITTE MANUELL EINTRAGEN
Freiheitsberaubung § 239 StGB;Raub u. Erpressung,räuber. Angriff auf Kraftfahrer
Freisetzen ionisierender Strahlen § 311 StGB;NICHT GEFUNDEN - BITTE MANUELL EINTRAGEN
Fälschung beweiserheblicher Daten, Täuschung im Rechtsverkehr bei Datenverarbeitung §§ 269, 270 StGB;Straftaten im Straßenverkehr nach dem StGB
Fälschung technischer Aufzeichnungen § 268 StGB;NICHT GEFUNDEN - BITTE MANUELL EINTRAGEN
Fälschung von Zahlungskarten mit oder ohne Garantiefunktion, Schecks und Wechseln §§ 152a, 152b StGB;NICHT GEFUNDEN - BITTE MANUELL EINTRAGEN
Fälschung von Zahlungskarten mit oder ohne Garantiefunktion, Schecks, Wechseln und anderen körperlichen unbaren Zahlungsinstrumenten §§ 152a, 152b StGB;NICHT GEFUNDEN - BITTE MANUELL EINTRAGEN
Fälschung zur Erlangung von Betäubungsmitteln;Straftaten nach dem Betäubungsmittelgesetz
Förderung sexueller Handlungen Minderjähriger oder Ausbeuten von Prostituierten §§ 180, 180a StGB;Vergewaltigung
Förderung sexueller Handlungen Minderjähriger § 180 StGB;Vergewaltigung
Gebrauch falscher Zahlungskarten mit oder ohne Garantiefunktion, Schecks und Wechsel §§ 152a, 152b StGB;NICHT GEFUNDEN - BITTE MANUELL EINTRAGEN
Gebrauch falscher Zahlungskarten mit oder ohne Garantiefunktion, Schecks, Wechsel und anderer körperlicher unbarer Zahlungsinstrumente §§ 152a, 152b StGB;NICHT GEFUNDEN - BITTE MANUELL EINTRAGEN
Gefährdung schutzbedürftiger Gebiete § 329 StGB;NICHT GEFUNDEN - BITTE MANUELL EINTRAGEN
Gefährliche und schwere Körperverletzung auf Straßen, Wegen oder Plätzen;Gefährliche und schwere Körperverletzung
Gefährliche und schwere Körperverletzung, Verstümmelung weiblicher Genitalien §§ 224, 226, 226a, 231 StGB;Gefährliche und schwere Körperverletzung
Geiselnahme i.V.m. Raubüberfall auf Geld- und Werttransporte;Raub u. Erpressung,räuber. Angriff auf Kraftfahrer
Geiselnahme i.V.m. Raubüberfall auf Geldinstitute, Postfilialen und -agenturen;Raub u. Erpressung,räuber. Angriff auf Kraftfahrer
Geiselnahme i.V.m. Raubüberfall auf sonstige Kassenräume und Geschäfte;Raub u. Erpressung,räuber. Angriff auf Kraftfahrer
Geiselnahme § 239b StGB;Raub u. Erpressung,räuber. Angriff auf Kraftfahrer
Geld- und Wertzeichenfälschung einschl. Vorbereitungshandlungen §§ 146 außer Abs. 1 Nr. 3, 148, 149, 151, 152 StGB;NICHT GEFUNDEN - BITTE MANUELL EINTRAGEN
Geld- und Wertzeichenfälschung, Fälschung von Zahlungskarten mit oder ohne Garantiefunktion, Schecks und Wechseln §§ 146-149, 151, 152, 152a, 152b StGB;NICHT GEFUNDEN - BITTE MANUELL EINTRAGEN
Geld- und Wertzeichenfälschung, Fälschung von Zahlungskarten mit oder ohne Garantiefunktion, Schecks, Wechseln und anderen körperlichen unbaren Zahlungsinstrumenten sowie die Vorbereitung des Diebstahls und der Unterschlagung §§ 146-149, 151, 152, 152a, 152b, 152c StGB;Diebstahl und Unterschlagung
Geldkreditbetrug;Betrug
Geldwäsche, Verschleierung unrechtmäßig erlangter Vermögenswerte § 261 StGB;NICHT GEFUNDEN - BITTE MANUELL EINTRAGEN
Gemeingefährliche Vergiftung § 314 StGB;Gefährliche und schwere Körperverletzung
Geschäftsmäßige Förderung der Selbsttötung;Mord und Totschlag
Gewaltdarstellung § 131 StGB;NICHT GEFUNDEN - BITTE MANUELL EINTRAGEN
Gewaltdarstellung, Inhalte an Personen unter 18 Jahren § 131 Abs. 1 Nr. 1b StGB;NICHT GEFUNDEN - BITTE MANUELL EINTRAGEN
Gewaltdarstellung, Schriften an Personen unter 18 Jahren § 131 Abs. 1 Nr. 3 StGB;NICHT GEFUNDEN - BITTE MANUELL EINTRAGEN
Gewaltkriminalität;NICHT GEFUNDEN - BITTE MANUELL EINTRAGEN
Gewerbs- und bandenmäßige Verleitung zur missbräuchlichen Asylantragstellung § 84a Asylgesetz;Straftaten nach dem Aufenthaltsgesetz
Gewerbsmäßige Bandenhehlerei von Kfz § 260a StGB;Diebstahl und Unterschlagung
Gewerbsmäßige Hehlerei von Kfz § 260 Abs. 1 Nr. 1 StGB;Diebstahl und Unterschlagung
Gewässerverunreinigung § 324 StGB;Gemeingefährliche einschl. Umweltstraftaten (o.V.)
Gläubigerbegünstigung § 283c StGB;NICHT GEFUNDEN - BITTE MANUELL EINTRAGEN
Glücksspiel §§ 284, 285, 287 StGB;NICHT GEFUNDEN - BITTE MANUELL EINTRAGEN
Großviehdiebstahl;Diebstahl und Unterschlagung
Handtaschenraub;Raub u. Erpressung,räuber. Angriff auf Kraftfahrer
Hausfriedensbruch § 123 StGB;NICHT GEFUNDEN - BITTE MANUELL EINTRAGEN
Hausfriedensbruch §§ 123, 124 StGB;NICHT GEFUNDEN - BITTE MANUELL EINTRAGEN
Hehlerei von Kfz §§ 259-260a StGB;Diebstahl und Unterschlagung
Herbeiführen einer Explosion durch Kernenergie § 307 StGB;Gemeingefährliche einschl. Umweltstraftaten (o.V.)
Herbeiführen einer Sprengstoffexplosion § 308 StGB;Gemeingefährliche einschl. Umweltstraftaten (o.V.)
Illegale Ausfuhr von Kulturgut § 83 Abs. 1 Nr. 1, 2 und Abs. 2 KGSG;NICHT GEFUNDEN - BITTE MANUELL EINTRAGEN
Illegale Einfuhr von Kulturgut § 83 Abs. 1 Nr. 3 KGSG;NICHT GEFUNDEN - BITTE MANUELL EINTRAGEN
Illegale Verbringung gefährlicher Abfälle § 18a AbfVerbrG;Gefährliche und schwere Körperverletzung
Illegale Verbringung nichtgefährlicher Abfälle § 18b AbfVerbrG;Gefährliche und schwere Körperverletzung
Illegaler Handel mit Kulturgut § 83 Abs. 1 Nr. 4, 5 und Abs. 5 KGSG;NICHT GEFUNDEN - BITTE MANUELL EINTRAGEN
Insolvenzstraftaten gemäß StGB und Nebenstrafrecht (Wikri);NICHT GEFUNDEN - BITTE MANUELL EINTRAGEN
Insolvenzstraftaten §§ 283, 283a-d StGB;NICHT GEFUNDEN - BITTE MANUELL EINTRAGEN
Insolvenzverschleppung § 15a InsO;NICHT GEFUNDEN - BITTE MANUELL EINTRAGEN
Inverkehrbringen von Falschgeld §§ 146 Abs. 1 Nr. 3, 147, 151, 152 StGB;Straftaten im Straßenverkehr nach dem StGB
Inverkehrbringen, Erwerb und Besitz von Sexpuppen mit kindlichem Erscheinungsbild § 184l StGB;Straftaten im Straßenverkehr nach dem StGB
Jagdwilderei § 292 StGB;NICHT GEFUNDEN - BITTE MANUELL EINTRAGEN
Kapitalanlage- und Anlagebetrug;Betrug
Kinderhandel § 236 StGB;NICHT GEFUNDEN - BITTE MANUELL EINTRAGEN
Kindstötung § 217 StGB;Mord und Totschlag
Kindstötung § 217 StGB (einschl. der unaufgeklärten Fälle der Tötung neugeborener Kinder);Mord und Totschlag
Kreditbetrug § 265b StGB (im geschäftlichen Verkehr);Betrug
Krediterlangungsbetrug § 263 StGB;Betrug
Kreditvermittlungsbetrug § 263 StGB;Betrug
Körperverletzung im Amt § 340 StGB;Körperverletzung
Körperverletzung mit Todesfolge §§ 227, 231 StGB;Körperverletzung
Körperverletzung §§ 223-227, 229, 231 StGB;Körperverletzung
Ladendiebstahl insgesamt;Diebstahl und Unterschlagung
Landfriedensbruch §§ 125, 125a StGB;NICHT GEFUNDEN - BITTE MANUELL EINTRAGEN
Leichtfertige Verursachung des Todes eines Anderen durch Abgabe pp. von Betäubungsmitteln § 30 Abs. 1 Nr. 3 BtMG;Straftaten nach dem Betäubungsmittelgesetz
Leistungsbetrug;Betrug
Leistungskreditbetrug;Betrug
Leistungskreditbetrug §§ 263, 263a StGB;Betrug
Luftverunreinigung § 325 StGB;NICHT GEFUNDEN - BITTE MANUELL EINTRAGEN
Menschenhandel insgesamt;Straftaten insgesamt
Menschenhandel, Zwangsprostitution, Zwangsarbeit, Ausbeutung der Arbeitskraft und Ausbeutung unter Ausnutzung einer Freiheitsberaubung §§ 232, 232a, 232b, 233, 233a StGB;Raub u. Erpressung,räuber. Angriff auf Kraftfahrer
Menschenraub § 234 StGB;Raub u. Erpressung,räuber. Angriff auf Kraftfahrer
Menschenraub, Entziehung Minderjähriger, Kinderhandel §§ 234, 235, 236 StGB;Raub u. Erpressung,räuber. Angriff auf Kraftfahrer
Missbrauch ionisierender Strahlen § 309 StGB;Sexueller Missbrauch von Kindern
Missbrauch von Scheck- und Kreditkarten § 266b StGB;NICHT GEFUNDEN - BITTE MANUELL EINTRAGEN
Missbräuchliche Nutzung von Telekommunikationsdiensten § 263a StGB;NICHT GEFUNDEN - BITTE MANUELL EINTRAGEN
Misshandlung von Kindern;Sexueller Missbrauch von Kindern
Misshandlung von Schutzbefohlenen § 225 StGB;NICHT GEFUNDEN - BITTE MANUELL EINTRAGEN
Mord im Zusammenhang mit Raubdelikten;Mord und Totschlag
Mord im Zusammenhang mit Sexualdelikten;Mord und Totschlag
Mord § 211 StGB;Mord und Totschlag
Mord § 211 StGB darunter:;Mord und Totschlag
Mord, Totschlag und Tötung auf Verlangen;Mord und Totschlag
Nachmachen, Verfälschen, Verschaffen, Feilhalten oder Überlassen falscher Zahlungskarten mit oder ohne Garantiefunktion, Schecks und Wechsel §§ 152a, 152b StGB;NICHT GEFUNDEN - BITTE MANUELL EINTRAGEN
Nachmachen, Verfälschen, Verschaffen, Feilhalten oder Überlassen falscher Zahlungskarten mit oder ohne Garantiefunktion, Schecks, Wechsel und anderer körperlicher unbarer Zahlungsinstrumente §§ 152a, 152b StGB;NICHT GEFUNDEN - BITTE MANUELL EINTRAGEN
Nachstellung (Stalking) § 238 StGB;NICHT GEFUNDEN - BITTE MANUELL EINTRAGEN
Nötigung § 240 StGB;NICHT GEFUNDEN - BITTE MANUELL EINTRAGEN
Prospektbetrug (Kapitalanlagebetrug) § 264a StGB;Betrug
Provisionsbetrug;Betrug
Raub zur Erlangung von Betäubungsmitteln;Straftaten nach dem Betäubungsmittelgesetz
Raub, räuberische Erpressung auf/gegen Geld- und Kassenboten;Raub u. Erpressung,räuber. Angriff auf Kraftfahrer
Raub, räuberische Erpressung auf/gegen Geld- und Werttransporte;Raub u. Erpressung,räuber. Angriff auf Kraftfahrer
Raub, räuberische Erpressung auf/gegen Geldinstitute (Banken/Sparkassen);Raub u. Erpressung,räuber. Angriff auf Kraftfahrer
Raub, räuberische Erpressung auf/gegen Geldinstitute, Postfilialen und -agenturen;Raub u. Erpressung,räuber. Angriff auf Kraftfahrer
Raub, räuberische Erpressung auf/gegen Postfilialen und -agenturen;Raub u. Erpressung,räuber. Angriff auf Kraftfahrer
Raub, räuberische Erpressung auf/gegen Spezialgeldtransportfahrzeuge;Raub u. Erpressung,räuber. Angriff auf Kraftfahrer
Raub, räuberische Erpressung auf/gegen Spielhallen;Raub u. Erpressung,räuber. Angriff auf Kraftfahrer
Raub, räuberische Erpressung auf/gegen Tankstellen;Raub u. Erpressung,räuber. Angriff auf Kraftfahrer
Raub, räuberische Erpressung auf/gegen sonstige Kassenräume und Geschäfte;Raub u. Erpressung,räuber. Angriff auf Kraftfahrer
Raub, räuberische Erpressung und räuberischer Angriff auf Kraftfahrer §§ 249-252, 255, 316a StGB;Raub u. Erpressung,räuber. Angriff auf Kraftfahrer
Raubmord;Mord und Totschlag
Raubüberfälle in Wohnungen;Raub u. Erpressung,räuber. Angriff auf Kraftfahrer
Rauschgiftdelikte (soweit nicht bereits mit anderer Schlüsselzahl erfasst);NICHT GEFUNDEN - BITTE MANUELL EINTRAGEN
Rauschgiftkriminalität darunter:;NICHT GEFUNDEN - BITTE MANUELL EINTRAGEN
Rohheitsdelikte und Straftaten gegen die persönliche Freiheit;Andere Straftaten gegen die Person (ohne Verkehr)
Räuberischer Angriff auf Kraftfahrer § 316a StGB;Raub u. Erpressung,räuber. Angriff auf Kraftfahrer
Sachbeschädigung an Kfz;NICHT GEFUNDEN - BITTE MANUELL EINTRAGEN
Sachbeschädigung durch Graffiti insgesamt;NICHT GEFUNDEN - BITTE MANUELL EINTRAGEN
Sachbeschädigung §§ 303-305a StGB;NICHT GEFUNDEN - BITTE MANUELL EINTRAGEN
Schuldnerbegünstigung § 283d StGB;NICHT GEFUNDEN - BITTE MANUELL EINTRAGEN
Schwere Gefährdung durch Freisetzen von Giften § 330a StGB;NICHT GEFUNDEN - BITTE MANUELL EINTRAGEN
Schwerer Diebstahl an/aus Kraftfahrzeugen;Diebstahl und Unterschlagung
Schwerer Diebstahl in/aus Banken, Sparkassen, Postfilialen und -agenturen und dergleichen;Diebstahl und Unterschlagung
Schwerer Diebstahl in/aus Boden-, Kellerräumen und Waschküchen;Diebstahl und Unterschlagung
Schwerer Diebstahl in/aus Dienst-, Büro-, Fabrikations-, Werkstatt- und Lagerräumen;Diebstahl und Unterschlagung
Schwerer Diebstahl in/aus Gaststätten, Kantinen, Hotels und Pensionen;Diebstahl und Unterschlagung
Schwerer Diebstahl in/aus Kiosken, Warenhäusern, Verkaufsräumen, Selbstbedienungsläden, Schaufenstern und Schaukästen darunter:;Diebstahl und Unterschlagung
Schwerer Diebstahl in/aus Kiosken, Warenhäusern, Verkaufsräumen, Selbstbedienungsläden, Schaufenstern, Schaukästen und Vitrinen darunter:;Diebstahl und Unterschlagung
Schwerer Diebstahl in/aus überwiegend unbezogenen Neu- und Rohbauten und Baustellen;Diebstahl und Unterschlagung
Schwerer Diebstahl in/aus überwiegend unbezogenen Neu- und Rohbauten, Baubuden und Baustellen;Diebstahl und Unterschlagung
Schwerer Diebstahl von Antiquitäten, Kunst- und sakralen Gegenständen;Diebstahl und Unterschlagung
Schwerer Diebstahl von Betäubungsmitteln aus Apotheken;Diebstahl und Unterschlagung
Schwerer Diebstahl von Betäubungsmitteln aus Arztpraxen;Diebstahl und Unterschlagung
