pks_straftat_bezeichnung;justiz_straftat_bezeichnung_mapped
Schwerer Diebstahl von Betäubungsmitteln aus Krankenhäusern;Diebstahl und Unterschlagung
Schwerer Diebstahl von Betäubungsmitteln bei Herstellern und Großhändlern;Diebstahl und Unterschlagung
Schwerer Diebstahl von Fahrrädern;Diebstahl und Unterschlagung
Schwerer Diebstahl von Kraftwagen;Diebstahl und Unterschlagung
Schwerer Diebstahl von Mopeds und Krafträdern;Diebstahl und Unterschlagung
Schwerer Diebstahl von Rezeptformularen zur Erlangung von Betäubungsmitteln;Diebstahl und Unterschlagung
Schwerer Diebstahl von Schusswaffen;Diebstahl und Unterschlagung
Schwerer Diebstahl von unbaren Zahlungsmitteln;Diebstahl und Unterschlagung
Schwerer Diebstahl von/aus Automaten;Diebstahl und Unterschlagung
Schwerer Hausfriedensbruch § 124 StGB;NICHT GEFUNDEN - BITTE MANUELL EINTRAGEN
Schwerer Ladendiebstahl;Diebstahl und Unterschlagung
Schwerer Sexueller Missbrauch von Kindern - Vollzug des Beischlafs mit einem Kind oder Vornahme einer ähnlichen sexuellen Handlung nach § 176c Abs. 1 Nr. 2 StGB;Vergewaltigung
Schwerer sexueller Missbrauch von Kindern - Herstellung und Verbreitung pornographischer Inhalte § 176c Abs. 2 StGB;Vergewaltigung
Schwerer sexueller Missbrauch von Kindern - mit schwerer körperlicher Misshandlung oder Gefahr des Todes § 176c Abs. 3 StGB;Vergewaltigung
Schwerer sexueller Missbrauch von Kindern - sonstige Begehungsweisen  § 176c Abs. 1 Nr. 1, 3, 4  StGB;Vergewaltigung
Schwerer sexueller Missbrauch von Kindern - sonstige Begehungsweisen gem. § 176c StGB;Vergewaltigung
Schwerer sexueller Missbrauch von Kindern - sonstige Begehungsweisen § 176c Abs. 1 Nr. 1, 3, 4 StGB;Vergewaltigung
Schwerer sexueller Missbrauch von Kindern zur Herstellung und Verbreitung pornografischer Schriften § 176a Abs. 3 StGB;Vergewaltigung
Sexualmord;Mord und Totschlag
Sexuelle Belästigung § 184i StGB;Vergewaltigung
Sexuelle Handlungen § 176 Abs. 1 und 2 StGB;Vergewaltigung
Sexuelle Handlungen § 176 Abs. 4 Nr. 2 StGB;Vergewaltigung
Sexueller Missbrauch von Jugendlichen gegen Entgelt § 182 Abs. 2 StGB;Vergewaltigung
Sexueller Missbrauch von Jugendlichen § 182 StGB;Vergewaltigung
Sexueller Missbrauch von Kindern - Einwirken auf Kind durch pornographischen Inhalt oder entsprechende Reden § 176a Abs. 1 Nr. 3 StGB;Vergewaltigung
Sexueller Missbrauch von Kindern - Einwirken auf Kind zur Vorbereitung sex. Missbrauchs  § 176b Abs. 1 StGB;Vergewaltigung
Sexueller Missbrauch von Kindern - Einwirken auf Kind zur Vorbereitung sex. Missbrauchs § 176b Abs. 1 StGB;Vergewaltigung
Sexueller Missbrauch von Kindern - Einwirken auf Kinder ohne Körperkontakt mit dem Kind § 176a Abs. 1 Nr 3   i.V.m. Absatz 3 StGB;Vergewaltigung
Sexueller Missbrauch von Kindern - Einwirken auf Kinder ohne Körperkontakt mit dem Kind § 176a Abs. 1 Nr 3 i.V.m. Absatz 3 StGB;Vergewaltigung
"Sexueller Missbrauch von Kindern - Einwirken auf Kinder ohne Körperkontakt § 176a Abs. 1 Nr. 3; 176b Abs. 1 Nr. 1 und 2  StGB";Vergewaltigung
"Sexueller Missbrauch von Kindern - Einwirken auf Kinder ohne Körperkontakt § 176a Abs. 1 Nr. 3; 176b Abs. 1 Nr. 1 und 2 StGB";Vergewaltigung
Sexueller Missbrauch von Kindern - Täter bestimmt Kind, sexuelle Handlungen an sich selbst vorzunehmen § 176a Abs 1 Nr. 2 StGB;Vergewaltigung
Sexueller Missbrauch von Kindern - sexuelle Handlungen an Kind/durch Kind vornehmen lässt § 176 Abs 1 Nr. 1 und 2 StGB;Vergewaltigung
Sexueller Missbrauch von Kindern mit Todesfolge § 176b StGB;Vergewaltigung
Sexueller Missbrauch von Kindern mit Todesfolge § 176d StGB;Vergewaltigung
Sexueller Missbrauch von Kindern §§ 176, 176a, 176b StGB;Vergewaltigung
Sexueller Missbrauch von Kindern §§ 176-176e StGB;Vergewaltigung
Sexueller Missbrauch von Schutzbefohlenen pp., unter Ausnutzung einer Amtsstellung oder eines Vertrauensverhältnisses §§ 174, 174a-c StGB;Vergewaltigung
Sexueller Missbrauch §§ 176, 176a, 176b, 182, 183, 183a StGB;Vergewaltigung
Sexueller Missbrauch §§ 176-176e, 182, 183, 183a StGB;Vergewaltigung
Sexueller Übergriff und sexuelle Nötigung im besonders schweren Fall § 177 Abs. 1, 2, 4, 5 i. V. m. Abs. 6 Nr. 2, Abs. 7, 8 StGB;Vergewaltigung
Sexueller Übergriff und sexuelle Nötigung § 177 Abs. 1, 2, 4, 5, 9 StGB;Vergewaltigung
Sexueller Übergriff, sexuelle Nötigung und Vergewaltigung mit Todesfolge § 178 StGB;Vergewaltigung
Softwarepiraterie;NICHT GEFUNDEN - BITTE MANUELL EINTRAGEN
Softwarepiraterie (private Anwendung z.B. Computerspiele);NICHT GEFUNDEN - BITTE MANUELL EINTRAGEN
Softwarepiraterie in Form gewerbsmäßigen Handelns;NICHT GEFUNDEN - BITTE MANUELL EINTRAGEN
Sonstige Bandenhehlerei § 260 Abs. 1 Nr. 2 StGB;Diebstahl und Unterschlagung
Sonstige Gewerbsmäßige Bandenhehlerei § 260a StGB;Diebstahl und Unterschlagung
Sonstige Hehlerei §§ 259-260a StGB;Diebstahl und Unterschlagung
Sonstige Raubüberfälle auf Straßen, Wegen oder Plätzen;Raub u. Erpressung,räuber. Angriff auf Kraftfahrer
Sonstige Sachbeschädigung auf Straßen, Wegen oder Plätzen;NICHT GEFUNDEN - BITTE MANUELL EINTRAGEN
Sonstige Straftatbestände (StGB);Straftaten nach dem StGB (ohne Verkehr)
Sonstige Straftaten im Amt §§ 258a, 339-353d, 355, 357 StGB;NICHT GEFUNDEN - BITTE MANUELL EINTRAGEN
Sonstige Straftaten nach dem StGB mit Umweltrelevanz;Gemeingefährliche einschl. Umweltstraftaten (o.V.)
Sonstige Verstöße gegen das Aufenthaltsgesetz;Straftaten nach dem Aufenthaltsgesetz
Sonstige Verstöße gegen das BtMG;Straftaten nach dem Betäubungsmittelgesetz
Sonstige gewerbsmäßige Hehlerei § 260 Abs. 1 Nr. 1 StGB;Diebstahl und Unterschlagung
Sonstige weitere Betrugsarten;Betrug
Sonstiger Betrug;Betrug
Sonstiger Sexueller Missbrauch von Jugendlichen § 182 StGB;Vergewaltigung
Sonstiger Warenkreditbetrug;Betrug
Sonstiger schwerer sexueller Missbrauch von Kindern § 176a StGB;Vergewaltigung
Sozialleistungsbetrug;Betrug
Sportwettbetrug und Manipulation von berufssportlichen Wettbewerben §§ 265c-e StGB;Betrug
Sprengstoff;NICHT GEFUNDEN - BITTE MANUELL EINTRAGEN
Sprengstoff- und Strahlungsverbrechen §§ 307-312 StGB;NICHT GEFUNDEN - BITTE MANUELL EINTRAGEN
Strafbarer Eigennutz §§ 284, 285, 287-293, 297 StGB;NICHT GEFUNDEN - BITTE MANUELL EINTRAGEN
Strafrechtliche Nebengesetze;Straftaten insgesamt
Straftaten auf dem Umwelt- und Verbraucherschutzsektor gemäß strafrechtlicher Nebengesetze;Gemeingefährliche einschl. Umweltstraftaten (o.V.)
Straftaten aus Gruppen § 184j StGB;Straftaten im Straßenverkehr nach dem StGB
Straftaten gegen Bestimmungen zum Schutze der Jugend;Straftaten gegen die sexuelle Selbstbestimmung
Straftaten gegen das Aufenthalts-, das Asyl- und das Freizügigkeitsgesetz/EU;Straftaten nach dem Aufenthaltsgesetz
Straftaten gegen das Ausgangsstoffgesetz;Straftaten nach dem Betäubungsmittelgesetz
Straftaten gegen das Bundes- (oder Landes-) Datenschutzgesetz;Straftaten nach anderen Bundes- u. Landesgesetzen
Straftaten gegen das Kriegswaffenkontrollgesetz;Straftaten nach dem Aufenthaltsgesetz
Straftaten gegen das Leben;Straftaten gegen die sexuelle Selbstbestimmung
Straftaten gegen das Sprengstoff-, das Waffen- und das Kriegswaffenkontrollgesetz;NICHT GEFUNDEN - BITTE MANUELL EINTRAGEN
Straftaten gegen das Sprengstoff-, das Waffen-, das Kriegswaffenkontrollgesetz und das Ausgangsstoffgesetz;NICHT GEFUNDEN - BITTE MANUELL EINTRAGEN
Straftaten gegen das Sprengstoffgesetz;Straftaten nach dem Straßenverkehrsgesetz
Straftaten gegen das Waffengesetz;Straftaten nach dem Aufenthaltsgesetz
Straftaten gegen die Umwelt §§ 324, 324a, 325-330a StGB;Gemeingefährliche einschl. Umweltstraftaten (o.V.)
Straftaten gegen die persönliche Freiheit §§ 232-233a, 234, 235, 236, 237, 238-239b, 240, 241, 316c StGB;NICHT GEFUNDEN - BITTE MANUELL EINTRAGEN
Straftaten gegen die sexuelle Selbstbestimmung insgesamt;Vergewaltigung
Straftaten gegen die sexuelle Selbstbestimmung §§ 174, 174a, 174b, 174c, 177, 178, 184i, 184j StGB;Vergewaltigung
Straftaten gegen sonstige strafrechtliche Nebengesetze -ohne Verkehrsdelikte-;Straftaten im Straßenverkehr nach dem StGB
Straftaten gegen strafrechtliche Nebengesetze auf dem Umwelt- und Verbraucherschutzsektor (neben Schlüssel 716000);Gemeingefährliche einschl. Umweltstraftaten (o.V.)
Straftaten gegen strafrechtliche Nebengesetze auf dem Wirtschaftssektor;NICHT GEFUNDEN - BITTE MANUELL EINTRAGEN
Straftaten gegen § 24 des Passgesetzes;Straftaten nach anderen Bundes- u. Landesgesetzen
Straftaten gegen § 27 Abs. 1 des Jugendschutzgesetzes;Straftaten nach anderen Bundes- u. Landesgesetzen
Straftaten gegen § 27 Abs. 2 des Jugendschutzgesetzes;Straftaten nach anderen Bundes- u. Landesgesetzen
Straftaten gegen § 9 FreizügG/EU;Straftaten insgesamt
Straftaten gegen §§ 84, 85 Asylgesetz;Straftaten nach dem Aufenthaltsgesetz
Straftaten gem. § 25 MedCanG;Straftaten insgesamt
Straftaten gem. § 34 KCanG;Straftaten insgesamt
Straftaten gemäß § 4 NpSG;Straftaten nach dem Betäubungsmittelgesetz
Straftaten i.V.m. dem Bankgewerbe sowie Wertpapierhandelsgesetz (Güd-Kreditwesen, BörsenG, DepotG, PfandBG, § 35 BundesbankG, ZAG);NICHT GEFUNDEN - BITTE MANUELL EINTRAGEN
Straftaten im Zusammenhang mit Lebens- und Arzneimitteln (z.B. Lebensmittel- und Futtermittelgesetzbuch, ArzneimittelG, WeinG);NICHT GEFUNDEN - BITTE MANUELL EINTRAGEN
Straftaten im Zusammenhang mit Urheberrechtsbestimmungen (UrheberrechtsG, MarkenG, § 23 Abs. 1, 2 und 4 GeschGehG, DesignG,GebrauchsmusterG, KunsturheberrechtsG, PatentG, HalbleiterschutzG);NICHT GEFUNDEN - BITTE MANUELL EINTRAGEN
Straftaten insgesamt;Straftaten insgesamt
Straftaten insgesamt auf dem Umwelt- und  Verbraucherschutzsektor;Gemeingefährliche einschl. Umweltstraftaten (o.V.)
Straftaten insgesamt auf dem Umwelt- und Verbraucherschutzsektor;Gemeingefährliche einschl. Umweltstraftaten (o.V.)
Straftaten insgesamt, jedoch ohne Verstöße gegen das Aufenthalts-, das Asyl- und das Freizügigkeitsgesetz/EU (Schlüssel 725000);Straftaten nach dem Aufenthaltsgesetz
Straftaten nach AktG, GenG, GmbHG, HGB, RechnungslegungsG, UmwandlungsG, InsO;NICHT GEFUNDEN - BITTE MANUELL EINTRAGEN
Straftaten nach dem Abfallverbringungsgesetz (AbfVerbrG);Gemeingefährliche einschl. Umweltstraftaten (o.V.)
Straftaten nach dem Anti-Doping-Gesetz (AntiDopG);Straftaten nach dem Aufenthaltsgesetz
Straftaten nach dem Arzneimittelgesetz (AMG);Straftaten nach dem Betäubungsmittelgesetz
Straftaten nach dem Bundesnaturschutz-, Tierschutz-, Bundesjagd- und PflanzenschutzG;Straftaten nach anderen Bundes- u. Landesgesetzen
Straftaten nach dem ChemikalienG;Straftaten nach dem Betäubungsmittelgesetz
Straftaten nach dem Infektionsschutz- und Tiergesundheitsgesetz;Straftaten nach dem Betäubungsmittelgesetz
Straftaten nach dem Kulturgutschutzgesetz (KGSG);Straftaten nach dem Aufenthaltsgesetz
Straftaten nach dem Lebensmittel- und Futtermittelgesetzbuch;Straftaten nach dem Betäubungsmittelgesetz
Straftaten nach dem Tierarzneimittelgesetz (TAMG);Straftaten nach dem Betäubungsmittelgesetz
Straftaten nach dem Weingesetz;Straftaten nach dem Aufenthaltsgesetz
Straßenkriminalität;Straftaten insgesamt
Subventionsbetrug § 264 StGB;Betrug
Tageswohnungseinbruch;Diebstahl und Unterschlagung
Tageswohnungseinbruchdiebstahl §§ 244 Abs. 1 Nr. 3 und Abs. 4, 244a StGB;Diebstahl und Unterschlagung
Tageswohnungseinbruchdiebstahl §§ 244 Abs. 1 Nr. 3, 244a StGB;Diebstahl und Unterschlagung
Taschendiebstahl insgesamt;Diebstahl und Unterschlagung
Totschlag und Tötung auf Verlangen §§ 212, 213, 216 StGB;Mord und Totschlag
Umschuldungsbetrug;Betrug
Umweltstraftaten gemäß 29. Abschnitt des StGB;Gemeingefährliche einschl. Umweltstraftaten (o.V.)
Unerlaubte Einfuhr in nicht geringer Menge von Amphetamin und seinen Derivaten in Pulver- oder flüssiger sowie in Tabletten- bzw. Kapselform (Ecstasy);Straftaten nach dem Betäubungsmittelgesetz
Unerlaubte Einfuhr in nicht geringer Menge von Cannabis und Zubereitungen;Straftaten nach dem Betäubungsmittelgesetz
Unerlaubte Einfuhr in nicht geringer Menge von Heroin;Straftaten nach dem Betäubungsmittelgesetz
Unerlaubte Einfuhr in nicht geringer Menge von Kokain einschl. Crack;Straftaten nach dem Betäubungsmittelgesetz
Unerlaubte Einfuhr in nicht geringer Menge von LSD;Straftaten nach dem Betäubungsmittelgesetz
Unerlaubte Einfuhr in nicht geringer Menge von Methamphetamin in Pulver-, kristalliner oder flüssiger sowie in Tabletten- bzw. Kapselform;Straftaten nach dem Betäubungsmittelgesetz
Unerlaubte Einfuhr in nicht geringer Menge von NPS (BtMG);Straftaten nach dem Betäubungsmittelgesetz
Unerlaubte Einfuhr in nicht geringer Menge von sonstigen Betäubungsmitteln;Straftaten nach dem Betäubungsmittelgesetz
Unerlaubte Einfuhr von Betäubungsmitteln § 30 Abs. 1 Nr. 4 BtMG (in nicht geringer Menge);Straftaten nach dem Betäubungsmittelgesetz
Unerlaubte Einreise § 95 Abs. 1 Nr. 3 und Abs. 2 Nr.1a Aufenthaltsgesetz;Straftaten nach dem Aufenthaltsgesetz
Unerlaubte Verschreibung und Verabreichung durch Ärzte § 29 Abs. 1 Nr. 6 BtMG;Straftaten nach dem Betäubungsmittelgesetz
Unerlaubte(r) Handel, Herstellung, Abgabe und Besitz in nicht geringer Menge von Betäubungsmitteln § 29a Abs. 1 Nr. 2 BtMG;Straftaten nach dem Betäubungsmittelgesetz
Unerlaubter Anbau von Betäubungsmitteln § 29 Abs. 1 Nr. 1 BtMG;Straftaten nach dem Betäubungsmittelgesetz
Unerlaubter Aufenthalt § 95 Abs. 1 Nr. 1, 2 und Abs. 2 Nr. 1b Aufenthaltsgesetz;Straftaten nach dem Aufenthaltsgesetz
Unerlaubter Handel mit und Schmuggel von  Methamphetamin in Pulver-, kristalliner oder flüssiger sowie in Tabletten- bzw. Kapselform;Straftaten nach dem Betäubungsmittelgesetz
Unerlaubter Handel mit und Schmuggel von Amphetamin und seinen Derivaten in Pulver- oder flüssiger sowie in Tabletten- bzw. Kapselform (Ecstasy);Straftaten nach dem Betäubungsmittelgesetz
Unerlaubter Handel mit und Schmuggel von Cannabis und Zubereitungen;Straftaten nach dem Betäubungsmittelgesetz
Unerlaubter Handel mit und Schmuggel von Heroin;Straftaten nach dem Betäubungsmittelgesetz
Unerlaubter Handel mit und Schmuggel von Kokain einschl. Crack;Straftaten nach dem Betäubungsmittelgesetz
Unerlaubter Handel mit und Schmuggel von LSD;Straftaten nach dem Betäubungsmittelgesetz
Unerlaubter Handel mit und Schmuggel von Methamphetamin in Pulver-, kristalliner oder flüssiger sowie in Tabletten- bzw. Kapselform;Straftaten nach dem Betäubungsmittelgesetz
Unerlaubter Handel mit und Schmuggel von NPS (BtMG);Straftaten nach dem Betäubungsmittelgesetz
Unerlaubter Handel mit und Schmuggel von Rauschgiften § 29 BtMG;Straftaten nach dem Betäubungsmittelgesetz
Unerlaubter Handel mit und Schmuggel von sonstigen Betäubungsmitteln;Straftaten nach dem Betäubungsmittelgesetz
Unerlaubter Umgang mit Abfällen § 326 außer Abs. 2 StGB;NICHT GEFUNDEN - BITTE MANUELL EINTRAGEN
Unerlaubter Umgang mit radioaktiven Stoffen und anderen gefährlichen Gütern § 328 StGB;Gefährliche und schwere Körperverletzung
Unerlaubtes Betreiben von Anlagen § 327 StGB;NICHT GEFUNDEN - BITTE MANUELL EINTRAGEN
Unterschlagung von Kfz §§ 246, 247 StGB;Diebstahl und Unterschlagung
Unterschlagung §§ 246, 247, 248a StGB;Diebstahl und Unterschlagung
Untreue bei Kapitalanlagegeschäften;Betrug
Untreue § 266 StGB;Betrug
Urkundenfälschung §§ 267-271, 273-279, 281 StGB;Urkundenfälschung
Verbreitung pornografischer Inhalte (Erzeugnisse) an Personen unter 18 Jahren § 184 Abs. 1 Nr. 1, 2, 5 StGB;NICHT GEFUNDEN - BITTE MANUELL EINTRAGEN
Verbreitung pornografischer Inhalte (Erzeugnisse) §§ 184, 184a, 184b, 184c, 184e StGB;NICHT GEFUNDEN - BITTE MANUELL EINTRAGEN
Verbreitung pornografischer Schriften (Erzeugnisse) an Personen unter 18 Jahren § 184 Abs. 1 Nr. 1, 2, 5 StGB;NICHT GEFUNDEN - BITTE MANUELL EINTRAGEN
Verbreitung pornografischer Schriften (Erzeugnisse) §§ 184, 184a, 184b, 184c, 184d, 184e StGB;NICHT GEFUNDEN - BITTE MANUELL EINTRAGEN
Verbreitung und Besitz von Anleitungen zu sexuellem Missbrauch von Kindern § 176e StGB;Vergewaltigung
Verbreitung, Erwerb, Besitz und Herstellung jugendpornografischer Inhalte § 184c StGB;NICHT GEFUNDEN - BITTE MANUELL EINTRAGEN
Verbreitung, Erwerb, Besitz und Herstellung jugendpornografischer Schriften § 184c StGB;NICHT GEFUNDEN - BITTE MANUELL EINTRAGEN
Verbreitung, Erwerb, Besitz und Herstellung kinderpornografischer Inhalte § 184b StGB;NICHT GEFUNDEN - BITTE MANUELL EINTRAGEN
Verbreitung, Erwerb, Besitz und Herstellung kinderpornografischer Schriften § 184b StGB;NICHT GEFUNDEN - BITTE MANUELL EINTRAGEN
Vergewaltigung § 177 Abs. 6, 7, 8 StGB;Vergewaltigung
Vergewaltigung, sexuelle Nötigung und sexueller Übergriff im besonders schweren Fall einschl. mit Todesfolge §§ 177, 178 StGB;Vergewaltigung
Verletzung der Buchführungspflicht § 283b StGB;Verletzung der Unterhaltspflicht
Verletzung der Fürsorge- oder Erziehungspflicht § 171 StGB;Verletzung der Unterhaltspflicht
Verletzung der Unterhaltspflicht § 170 StGB;Verletzung der Unterhaltspflicht
Verletzung des Dienstgeheimnisses § 353b StGB;NICHT GEFUNDEN - BITTE MANUELL EINTRAGEN
Verletzung des Intimbereichs durch Bildaufnahmen § 184k StGB;NICHT GEFUNDEN - BITTE MANUELL EINTRAGEN
Verletzung von Geschäftsgeheimnissen § 23 Abs. 1 Nr. 1, 2, Abs. 2 und 4 GeschGehG;NICHT GEFUNDEN - BITTE MANUELL EINTRAGEN
Verletzung von Geschäftsgeheimnissen § 23 Abs. 1 Nr. 3 und Abs. 4 GeschGehG;NICHT GEFUNDEN - BITTE MANUELL EINTRAGEN
Verletzung von Geschäftsgeheimnissen § 23 Abs. 3 GeschGehG, strafbare Werbung § 16 UWG;NICHT GEFUNDEN - BITTE MANUELL EINTRAGEN
Vermögens- und Fälschungsdelikte;Andere Vermögensdelikte
Versuch der Vorbereitung des sexuellen Missbrauchs von Kindern (Scheinkindkonstellation) § 176b Abs. 1 i.V.m. Abs. 3 StGB;Vergewaltigung
Versuch des Sexuellen Missbrauchs von Kindern ohne Körperkontakt mit dem Kind (Scheinkindkonstellation) § 176a Abs. 1 nr. 3 i.V.m. Abs. 3 StGB;Vergewaltigung
Veruntreuungen §§ 266, 266a, 266b StGB;NICHT GEFUNDEN - BITTE MANUELL EINTRAGEN
Verursachen von Lärm, Erschütterungen und nichtionisierenden Strahlen § 325a StGB;NICHT GEFUNDEN - BITTE MANUELL EINTRAGEN
Vollzug des Beischlafs mit einem Kind oder Vornahme einer ähnlichen sexuellen Handlung § 176a Abs. 2 Nr. 1 StGB;Vergewaltigung
Vorbereitung des Diebstahls (nach § 242 StGB) und der Unterschlagung  (nach § 246 StGB) von Zahlungskarten, Schecks, Wechseln und anderen körperlichen unbaren Zahlungsinstrumenten § 152c StGB;Diebstahl und Unterschlagung
Vorbereitung des Diebstahls (nach § 242 StGB) und der Unterschlagung (nach § 246 StGB) von Zahlungskarten, Schecks, Wechseln und anderen körperlichen unbaren Zahlungsinstrumenten § 152c StGB;Diebstahl und Unterschlagung
Vorbereitung des sexuellen Missbrauchs von Kindern gem § 176b Abs. 1, 3  StGB;Vergewaltigung
Vorbereitung des sexuellen Missbrauchs von Kindern gem § 176b Abs. 1, 3 StGB;Vergewaltigung
Vorbereitung eines Explosions- oder Strahlungsverbrechens § 310 StGB;Gemeingefährliche einschl. Umweltstraftaten (o.V.)
Vorenthalten und Veruntreuen von Arbeitsentgelt § 266a StGB;Betrug
Vorsätzliche einfache Körperverletzung § 223 StGB;Körperverletzung
Vorteilsannahme § 331 StGB;NICHT GEFUNDEN - BITTE MANUELL EINTRAGEN
Vorteilsannahme, Bestechlichkeit §§ 331, 332, 335 StGB;NICHT GEFUNDEN - BITTE MANUELL EINTRAGEN
Vorteilsgewährung § 333 StGB;NICHT GEFUNDEN - BITTE MANUELL EINTRAGEN
Vorteilsgewährung, Bestechung §§ 333, 334, 335 StGB;NICHT GEFUNDEN - BITTE MANUELL EINTRAGEN
Vortäuschen einer Straftat § 145d StGB;NICHT GEFUNDEN - BITTE MANUELL EINTRAGEN
Vortäuschen eines Diebstahls;Diebstahl und Unterschlagung
Vortäuschen eines Raubes;Raub u. Erpressung,räuber. Angriff auf Kraftfahrer
Waren- und Warenkreditbetrug;Betrug
Warenbetrug;Betrug
Wechselbetrug;Betrug
Weitere Straftaten mit Umweltrelevanz gemäß StGB;Gemeingefährliche einschl. Umweltstraftaten (o.V.)
Werbung für Betäubungsmittel § 29 Abs. 1 Nr. 8 BtMG;Straftaten nach dem Betäubungsmittelgesetz
Wertpapierbetrug;Betrug
Wettbewerbs-, Korruptions- und Amtsdelikte §§ 258a, 298-300, 331-353d, 355, 357 StGB;NICHT GEFUNDEN - BITTE MANUELL EINTRAGEN
Wettbewerbsbeschränkende Absprachen bei Ausschreibungen § 298 StGB;NICHT GEFUNDEN - BITTE MANUELL EINTRAGEN
Wettbewerbsdelikte (Wikri);NICHT GEFUNDEN - BITTE MANUELL EINTRAGEN
Widerstand gegen und tätlicher Angriff auf Vollstreckungsbeamte und gleichstehende Personen §§ 113-115 StGB;NICHT GEFUNDEN - BITTE MANUELL EINTRAGEN
Widerstand gegen und tätlicher Angriff auf die Staatsgewalt und Straftaten gegen die öffentliche Ordnung §§ 111, 113-115, 120, 121, 123-127, 129, 130a-134, 136, 138, 140, 145, 145a, 145c, 145d StGB;NICHT GEFUNDEN - BITTE MANUELL EINTRAGEN
Widerstand gegen und tätlicher Angriff auf die Staatsgewalt und Straftaten gegen die öffentliche Ordnung §§ 111, 113-115, 120, 121, 123-129, 130a-134, 136, 138, 140, 145, 145a, 145c, 145d StGB;NICHT GEFUNDEN - BITTE MANUELL EINTRAGEN
Widerstand gegen und tätlicher Angriff auf die Staatsgewalt §§ 111, 113-115, 120, 121 StGB;NICHT GEFUNDEN - BITTE MANUELL EINTRAGEN
Wilderei §§ 292, 293 StGB;NICHT GEFUNDEN - BITTE MANUELL EINTRAGEN
Wirtschaftskriminalität bei Betrug;Betrug
Wirtschaftskriminalität im Anlage- und Finanzierungsbereich pp.;NICHT GEFUNDEN - BITTE MANUELL EINTRAGEN
Wirtschaftskriminalität im Zusammenhang mit Arbeitsverhältnissen;NICHT GEFUNDEN - BITTE MANUELL EINTRAGEN
Wirtschaftskriminalität und zwar:;NICHT GEFUNDEN - BITTE MANUELL EINTRAGEN
Wohnungseinbruchdiebstahl § 244 Abs. 1 Nr. 3 StGB darunter:;Diebstahl und Unterschlagung
Wohnungseinbruchdiebstahl §§ 244 Abs. 1 Nr. 3 und Abs. 4,  244a StGB;Diebstahl und Unterschlagung
Wohnungseinbruchdiebstahl §§ 244 Abs. 1 Nr. 3 und Abs. 4, 244a StGB;Diebstahl und Unterschlagung
Wohnungseinbruchdiebstahl §§ 244 Abs. 1 Nr. 3, 244a StGB;Diebstahl und Unterschlagung
Wucher § 291 StGB;NICHT GEFUNDEN - BITTE MANUELL EINTRAGEN
Zechanschlussraub;Raub u. Erpressung,räuber. Angriff auf Kraftfahrer
Zerstörung wichtiger Arbeitsmittel § 305a StGB;NICHT GEFUNDEN - BITTE MANUELL EINTRAGEN
Zuhälterei § 181a StGB;NICHT GEFUNDEN - BITTE MANUELL EINTRAGEN
Zwangsheirat § 237 StGB;NICHT GEFUNDEN - BITTE MANUELL EINTRAGEN
Zwangsheirat, Nachstellung (Stalking), Freiheitsberaubung, Nötigung, Bedrohung §§ 237, 238, 239, 240, 241 StGB;Raub u. Erpressung,räuber. Angriff auf Kraftfahrer
an Kraftfahrzeugen;NICHT GEFUNDEN - BITTE MANUELL EINTRAGEN
direkte Beschaffungskriminalität;NICHT GEFUNDEN - BITTE MANUELL EINTRAGEN
in/aus Kiosken;Diebstahl und Unterschlagung
in/aus Kraftfahrzeugen;NICHT GEFUNDEN - BITTE MANUELL EINTRAGEN
in/aus Schaufenstern, Schaukästen und Vitrinen;NICHT GEFUNDEN - BITTE MANUELL EINTRAGEN
in/aus Warenhäusern, Verkaufsräumen, Selbstbedienungsläden darunter:;NICHT GEFUNDEN - BITTE MANUELL EINTRAGEN
in/aus Wohnräumen;NICHT GEFUNDEN - BITTE MANUELL EINTRAGEN
in/aus Wohnräumen darunter:;NICHT GEFUNDEN - BITTE MANUELL EINTRAGEN
sonstige Straftaten (Nebengesetze) auf dem Wirtschaftssektor (z.B. Rennwett- und LotterieG, § 23 Abs. 3 GeschGehG und UWG § 16, VersicherungsaufsichtsG, WirtschaftsstrafG, Gewerbeordnung);NICHT GEFUNDEN - BITTE MANUELL EINTRAGEN
von Sprengstoff;NICHT GEFUNDEN - BITTE MANUELL EINTRAGEN
von amtlichen Siegeln und Stempeln, Vordrucken für Ausweise und Kfz-Papiere;NICHT GEFUNDEN - BITTE MANUELL EINTRAGEN
Überweisungsbetrug §§ 263, 263a StGB;Betrug
